Secretaría de Educación de Meta;Nit;892000148;Carrera 33 No. 38-45 centro Piso 2;JENNY ANDREA CAPOTE AVENDAÑO;3102723495;6086818500;jalmeidap@meta.gov.co;inspeccionyvigilanciasedmeta@meta.gov.co;https://www.sedmeta.gov.co;Entidad Territorial Certificada;JORGE ARMANDO ALMEIDA PACHON ;Hector Julio Flechas Pacheco;JENNY ANDREA CAPOTE AVENDAÑO;Oficial;Pública;;;608;Meta;50;Villavicencio;50001;3102723495;3796;138;;;;;;;;;;;;;;;;
Secretaría de Educación de Montería;Nit;800096734;Carrera 15 # 22-40 Barrio Costa de Oro ;MARINO KLINGER GÓMEZ ARGUMEDO;3157353077;6047911668;hapena@semmonteria.gov.co;henrypenamontes75@gmail.com;https://www.monteria.gov.co/publicaciones/2142/educacion/;Entidad Territorial Certificada;HENRY ANTONIO PEÑA MONTES ;Hector Humberto Hernandez;MARINO KLINGER GÓMEZ ARGUMEDO;Oficial;Pública;;;604;Córdoba;23;Monteria;23001;3157353077;3782;106;;;;;;;;;;;;;;;;
Secretaría de Educación de Mosquera;Nit;899999342;Calle 10 No. 3. Centro Cultural Auditorio Piso 2;WILSON ERNESTO SÁNCHEZ PANTOJA;3155280451;6018270830 Ext 4800;secretariadeeducacion@mosquera-cundinamarca.gov.co;inspeccionyvigilanciamosquera@gmail.com;https://www.semmosquera.gov.co;Entidad Territorial Certificada;CARLOS ANDRÉS CARVAJAL GARCÍA;Hector Julio Flechas Pacheco;WILSON ERNESTO SÁNCHEZ PANTOJA;Oficial;Pública;;;601;Cundinamarca;25;Mosquera;25473;3155280451;10857;259;;;;;;;;;;;;;;;;
Secretaría de Educación de Nariño;Nit;800103923;Carrera 42B No. 18A-85 Barrio Pandiaco;ADRIÁN ALEXANDER ZEBALLOS CUATHIN ;3177539793;6027333737;jesus.gavilanes@sednarino.gov.co;jhgviteri@gmail.com;https://www.sednarino.gov.co;Entidad Territorial Certificada;JESUS HERALDO GAVILANES VITERI;Loida Ruth Silva Morales;ADRIÁN ALEXANDER ZEBALLOS CUATHIN ;Oficial;Pública;;;602;Nariño;52;Pasto;52001;3177539793;3798;144;;;;;;;;;;;;;;;;
Secretaría de Educación de Neiva;Nit;891180009;Carrera 5 No. 9-74 Edificio Municipal Piso 2;NATALIA ANDREA RODRIGUEZ GUTIERREZ;3103103617;6088716080;cesar.rincon@alcaldianeiva.gov.co;cesar.rincon@alcaldianeiva.gov.co;https://www.semneiva.gov.co/;Entidad Territorial Certificada;CESAR HERNANDO RINCÓN VALDERRAMA;Loida Ruth Silva Morales;NATALIA ANDREA RODRIGUEZ GUTIERREZ;Oficial;Pública;;;608;Huila;41;Neiva;41001;3103103617;3791;124;;;;;;;;;;;;;;;;
Secretaría de Educación de Norte de Santander;Nit;800103927;Avenida 3 E No. 1 E - 46  Barrio La Riviera;LAURA CRISTINA CÁCERES NIÑO;3022915509;6075915009 Ext 3104;pastor.pineres@nortedesantander.gov.co;pernorte@hotmail.com;https://www.sednortedesantander.gov.co/;Entidad Territorial Certificada;PASTOR PIÑERES VELANDIA;Jenifer Jaine Vergara Garces;LAURA CRISTINA CÁCERES NIÑO;Oficial;Pública;;;607;Norte de Santander;54;Cúcuta;54001;3022915509;3801;148;;;;;;;;;;;;;;;;
Secretaría de Educación de Palmira;Nit;891380007;Carrera 32 No. 46 -10 Barrio Estonia ;EDWIN REBOLLEDO CAICEDO ;3113256141;6022856121;leidy.mina@palmira.gov.co;leidyj.mina.v@gmail.com;https://www.sempalmira.gov.co/bienvenido/;Entidad Territorial Certificada;LEIDY JOHANNA MINA VÁSQUEZ;Hector Julio Flechas Pacheco;EDWIN REBOLLEDO CAICEDO ;Oficial;Pública;;;602;Valle del Cauca;76;Palmira;76520;3113256141;3822;192;;;;;;;;;;;;;;;;
Secretaría de Educación de Pasto;Nit;891280000;Calle 16 No. 23-57 Pisos 3 y 4  ;PIEDAD DEL CARMEN FIGUEROA AREVALO;3022583177;6027244326;emunoz@sempasto.gov.co;inspeccionyvigilancia@sempasto.gov.co;https://www.educacionpasto.gov.co/;Entidad Territorial Certificada;EDER JULIÁN MUÑOZ RINCÓN;Loida Ruth Silva Morales;PIEDAD DEL CARMEN FIGUEROA AREVALO;Oficial;Pública;;;602;Nariño;52;Pasto;52001;3022583177;3799;140;;;;;;;;;;;;;;;;
Secretaría de Educación de Pereira;Nit;891480030;Carrera 7 No. 18 - 55 Centro Pereira ;CARLOS JAIRO BEDOYA NARANJO;3053091031;6063248000;inspeccionyvigilancia@pereira.gov.co;yserviciosjuridicos@gmail.com;https://www.pereiraeduca.gov.co;Entidad Territorial Certificada;YESICA RENTERIA;Hector Humberto Hernandez;CARLOS JAIRO BEDOYA NARANJO;Oficial;Pública;;;606;Risaralda;66;Pereira;66001;3053091031;3806;158;;;;;;;;;;;;;;;;
Secretaría de Educación de Piedecuesta;Nit;890205383;Calle 3 AN # 9 - 25 Centro Comercial de la Cuesta Sótano 1 - Piedecuesta;JAVIER GERARDO VÁSQUEZ ORTIZ;3132285561;6076650444;Inspeccionyvigilancia@sempiedecuesta.edu.co;esremo0660@gmail.com;https://www.alcaldiadepiedecuesta.gov.co;Entidad Territorial Certificada;ESPERANZA REYES MORENO;Jenifer Jaine Vergara Garces;JAVIER GERARDO VÁSQUEZ ORTIZ;Oficial;Pública;;;607;Santander;68;Piedecuesta;68547;3132285561;4700;265;;;;;;;;;;;;;;;;
Secretaría de Educación de Pitalito;Nit;891180077;"Carrera 3 No. 4 - 78 Centro Administrativo Municipal ""La Chapolera""";OSCAR HUMBERTO CUELLAR CASTRO;3177720270;5,73184E+11;ladyyohana.claros@sempitalito.gov.co;Ladysclv@hotmail.com;https://www.sempitalito.gov.co/;Entidad Territorial Certificada;LADY YOHANA CLAROS VALENCIA;Loida Ruth Silva Morales;OSCAR HUMBERTO CUELLAR CASTRO;Oficial;Pública;;;57;Huila;41;Pitalito;41551;3177720270;4436;264;;;;;;;;;;;;;;;;
Secretaría de Educación de Popayán;Nit;891580006;Carrera 6 No. 4 - 21 Edificio CAM;ROBINSON FELIPE ACOSTA ORTEGA;3007913011;6028318480;inspeccion.sem@popayan.gov.co;rfisicos@yahoo.es;https://www.sempopayan.gov.co;Entidad Territorial Certificada;CARLOS EMIRO ERAZO;Loida Ruth Silva Morales;ROBINSON FELIPE ACOSTA ORTEGA;Oficial;Pública;;;602;Cauca;19;Popayán;19001;3007913011;3778;94;;;;;;;;;;;;;;;;
Secretaría de Educación de Putumayo;Nit;800094164;Carrera 8 No. 17 - 34 Barrio Ciudad Jardín (Mocoa);DIANA NATALY CALIZ ARTEAGA;3223727189;6084205724;padillacarlosamai@gmail.com;ilipac2@hotmail.com;https://www.sedputumayo.gov.co;Entidad Territorial Certificada;IGNACIO LIBARDO PADILLA CARLOSAMA;Loida Ruth Silva Morales;DIANA NATALY CALIZ ARTEAGA;Oficial;Pública;;;608;Putumayo;86;Mocoa;86001;3223727189;3826;150;;;;;;;;;;;;;;;;
Secretaría de Educación de Quibdó;Nit;891680011;Calle 28 No. 7 - 37  B/ El Silencio;MARYLENIS SALAS RODRIGUEZ;3108005103;6046723550;jorge.parra@semquibdo.edu.co;atencionalcuidadano@semquibdo.edu.co;https://www.semquibdo.gov.co ;Entidad Territorial Certificada;JORGE LORENZO PARRA MOSQUERA;Loida Ruth Silva Morales;MARYLENIS SALAS RODRIGUEZ;Oficial;Pública;;;604;Choco;27;Quibdó;27001;3108005103;4382;202;;;;;;;;;;;;;;;;
Secretaría de Educación de Quindío;Nit;890001639;Calle 20 No. 13 - 22 Gobernación del Quindío Pisos 1 y 9;TATIANA HERNÁNDEZ MEJÍA;3155886153;6067359919  Ext. 1288;Inspeccionvigilanciaeducacion@gobernacionquindio.gov.co;inspeccionvigilanciaquindio@gmail.com;https://www.sedquindio.gov.co/;Entidad Territorial Certificada;ALEJANDRO MAZO ARBELÁEZ;Jenifer Jaine Vergara Garces;TATIANA HERNÁNDEZ MEJÍA;Oficial;Pública;;;606;Quindío;63;Armenia;5059;3155886153;3803;154;;;;;;;;;;;;;;;;
Secretaría de Educación de Riohacha;Nit;892115007;Calle 7 No. 7 - 38;ALBERTO MARIO CUAN ;3006551912;6057287485;joseluisdeltorog@gmail.com;joseluisdeltorog@gmail.com;https://www.riohacha-laguajira.gov.co/;Entidad Territorial Certificada;JOSÉ LUIS DEL TORO GÓMEZ ;Jenifer Jaine Vergara Garces;ALBERTO MARIO CUAN ;Oficial;Pública;;;605;La Guajira;44;Riohacha;44001;3006551912;4449;255;;;;;;;;;;;;;;;;
Secretaría de Educación de Rionegro;Nit;890907317;Carrera 50 # 48-05, Centro Cultural Ricardo Rendón Bravo, Piso 2;MARÍA CAMILA HENAO HERNÁNDEZ;3136063752;6045204060;Ldelgado@rionegro.gov.co;Ldelgado@rionegro.gov.co;https://www.semrionegro.gov.co;Entidad Territorial Certificada;LEONARDO DELGADO;Marco Tulio Marquez Rozo;MARÍA CAMILA HENAO HERNÁNDEZ;Oficial;Pública;;;604;Antioquia;5;Rionegro;5615;3136063752;7609;266;;;;;;;;;;;;;;;;
Secretaría de Educación de Risaralda;Nit;891480085;Parque Olaya Herrera Calle 19 No. 13-17 Piso 2;DORA AGUDELO MARTÍNEZ;3104051369;6063398300;martha.castano@risaralda.gov.co;despacho.educacion@risaralda.gov.co;https://www.risaralda.gov.co/educacion/;Entidad Territorial Certificada;MARTHA  LUCIA CASTAÑO ECHEVERRY ;Hector Humberto Hernandez;DORA AGUDELO MARTÍNEZ;Oficial;Pública;;;606;Risaralda;66;Pereira;66001;3104051369;3805;160;;;;;;;;;;;;;;;;
Secretaría de Educación de Sabaneta;Nit;890980331;Calle 75 sur No. 45-44 piso 3° Biblioteca Pública Juan Carlos Montoya Montoy Barrio Calle Larga;PATRICIA RESTREPO VELEZ;3152632685;6044406670;luis.melo@sabaneta.gov.co;luis.melo@udea.edu.co;https://www.sabaneta.gov.co/educacion-y-cultura/presentacion;Entidad Territorial Certificada;LUIS EDUARDO MELO BURBANO;Hector Humberto Hernandez;PATRICIA RESTREPO VELEZ;Oficial;Pública;;;604;Antioquia;5;Sabaneta;5631;3152632685;7740;268;;;;;;;;;;;;;;;;
Secretaría de Educación de Sahagún;Nit;800096777;Calle 14 Nº 10 - 30 Oficina 103 Palacio Municipal;XEINA SAHALILE MARTÍNEZ PATERNINA;3015743009;6047599050;Inspeccionyvigilancia@semsahagun.gov.co;Myleov07@Hotmail.com;https://www.Sahagun-cordoba.gov.co;Entidad Territorial Certificada;ANA MYLENA OVIEDO HOYOS;Hector Humberto Hernandez;XEINA SAHALILE MARTÍNEZ PATERNINA;Oficial;Pública;;;604;Córdoba;23;Sahagún;23660;3015743009;3784;108;;;;;;;;;;;;;;;;
Secretaría de Educación de San Andrés de Tumaco;Nit;891200916;"Calle del Comercio Diagonal Combustibles ""La Bombita""";MARIA NARCISA CORTES MONTAÑO;3155544836;6027273877;Inspeccion@semtumaco.gov.co;anapaty078@hotmail.com;https://www.educacion-tumaco.gov.co;Entidad Territorial Certificada;ANA PATRICIA RISUEÑO;Loida Ruth Silva Morales;MARIA NARCISA CORTES MONTAÑO;Oficial;Pública;;;602;Nariño;52;Tumaco;52835;3155544836;3800;142;;;;;;;;;;;;;;;;
Secretaría de Educación de Santa Marta;Nit;891780009;Carrera 8 No. 28 A - 60 Santa Marta;SANDRA PATRICIA MUÑOZ DORADO;3116315278;6054209600;Inspeccionvigilanciased@santamarta.gov.co;Reyesperalta121@gmail.com;https://www.santamarta.gov.co;Entidad Territorial Certificada;ROBERT AVELINO REYES PERALTA;Hector Humberto Hernandez;SANDRA PATRICIA MUÑOZ DORADO;Oficial;Pública;;;605;Magdalena;47;Santa Marta;47001;3116315278;4911;164;;;;;;;;;;;;;;;;
Secretaría de Educación de Santander;Nit;890201235;Calle 37 No. 10 - 30 Palacio Amarillo Of. 202;OMAR NICOLÁS ORDÓÑEZ RUIZ;3112132754;6076910880;ca.mmrodriguez@santander.edu.co;marggymil72@gmail.com;https://santander.gov.co/publicaciones/270/secretaria-de-educacion/;Entidad Territorial Certificada;MARGGY MILENA RODRIGUEZ GOMEZ;Marco Tulio Marquez Rozo;OMAR NICOLÁS ORDÓÑEZ RUIZ;Oficial;Pública;;;607;Santander;68;Bucaramanga;68001;3112132754;3808;174;;;;;;;;;;;;;;;;
Secretaría de Educación de Sincelejo;Nit;800104062;Calle 21 No 17-40. Edificio EMPAS;DIEGO ALBERTO GALVÁN MESTRE;3005182890;6052828656; Bhoris.lopez@sincelejoaprende.edu.co;Bhoryzlopez63@gmail.con;https://www.semsincelejo.gov.co/;Entidad Territorial Certificada;BHORYS FIDEL LOPEZ MARTINEZ;Hector Humberto Hernandez;DIEGO ALBERTO GALVÁN MESTRE;Oficial;Pública;;;605;Sucre;70;Sincelejo;70001;3005182890;3814;176;;;;;;;;;;;;;;;;
Secretaría de Educación de Soacha;Nit;800094755;Carrera 7 No. 14 - 72 Casa de la Cultura;JOSÉ JHOAN ALFONSO HERNANDEZ;3167441615;601730 5580, Ext. 4003;narly.beltran@alcaldiasoacha.gov.co;saday.03@hotmail.com;https://www.soachaeducativa.edu.co ;Entidad Territorial Certificada;NARLY BELTRAN ;Hector Julio Flechas Pacheco;JOSÉ JHOAN ALFONSO HERNANDEZ;Oficial;Pública;;;601;Cundinamarca;25;Soacha;25754;3167441615;3788;116;;;;;;;;;;;;;;;;
Secretaría de Educación de Sogamoso;Nit;891855130;Carrera 11 No 18-02 Edificio de la Biblioteca;NATALIA MEDINA MORENO;3103429841;6087720262;vigilancia-educacion@sogamoso-boyaca.gov.co;educacion@sogamoso-boyaca.gov.co;https://sem-sogamoso-boyaca.gov.co/;Entidad Territorial Certificada;KEIRI YULITH FONSECA AFRICANO ;Hector Julio Flechas Pacheco;NATALIA MEDINA MORENO;Oficial;Pública;;;608;Boyacá;15;Sogamoso;15759;3103429841;3772;76;;;;;;;;;;;;;;;;
Secretaría de Educación de Soledad;Nit;890106291;Avenida Murillo, Km. 4, sede Gran Abastos;CAROLINA DEL CARMEN CORREA GALLARDO;3145948457;6053282687;Lferrer@semsoledad.gov.co;Lmf1972@gmail.com;https://www.semsoledad-atlantico.gov.co/;Entidad Territorial Certificada;LEOPOLDO FERRER PAJARO;Hector Julio Flechas Pacheco;CAROLINA DEL CARMEN CORREA GALLARDO;Oficial;Pública;;;605;Atlántico;8;Soledad;8758;3145948457;3765;62;;;;;;;;;;;;;;;;
Secretaría de Educación de Sucre;Nit;892280021;Calle 25 No. 25 B - 36 Avenida Las Peñitas;LUIS MANUEL ORTEGA CARDOZO;3015984503;6052799470;Maida.hoyos@gobsucre.gov.co;Maida.hoyos@gobsucre.gov.co;https://www.sedsucre.gov.co/;Entidad Territorial Certificada;MAIDA ALEJANDRA HOYOS ARRAZOLA;Hector Humberto Hernandez;LUIS MANUEL ORTEGA CARDOZO;Oficial;Pública;;;605;Sucre;70;Sincelejo;70001;3015984503;3813;178;;;;;;;;;;;;;;;;
Secretaría de Educación de Tolima;Nit;800113672;Carrera 3a. entre calles 10 A y 11 Piso 8 Parque Murillo Toro;ANDRÉS FELIPE BEDOYA CARDENAS;3166059098;6082611111 Ext. 1808;Andrea.mayoral@sedtolima.gov.co;inspeccionyvigilancia@sedtolima.gov.co;https://www.sedtolima.gov.co/;Entidad Territorial Certificada;ANDREA MAYORAL ORTIZ;Marco Tulio Marquez Rozo;ANDRÉS FELIPE BEDOYA CARDENAS;Oficial;Pública;;;608;Tolima;73;Ibagué;73001;3166059098;3815;182;;;;;;;;;;;;;;;;
Secretaría de Educación de Tuluá;Nit;891900272;Calle 25 Carrera 25 Esquina Piso 3;ROBERT POSADA ROSERO;3173002069;6022339300;Vigilanciaeducacion@tulua.gov.co;Albertoya43@gmail.com;https://www.semtulua.gov.co/;Entidad Territorial Certificada;LUIS ALBERTO VIDALES HOLGUIN ;Hector Julio Flechas Pacheco;ROBERT POSADA ROSERO;Oficial;Pública;;;602;Valle del Cauca;76;Tuluá;76834;3173002069;3823;194;;;;;;;;;;;;;;;;
Secretaría de Educación de Tunja;Nit;891800846;Calle 19 No. 9 - 95 piso 4 Casa del Fundador - Plaza de Bolívar;DANIEL MORENO ÁLVAREZ;3233993008;6087405770;Inspeccion.vigilancia@tunja.gov.co;Zenalogo@hotmail.com;https://www.semtunja.gov.co/;Entidad Territorial Certificada;ZENAIDA LÓPEZ GONZALEZ;Hector Julio Flechas Pacheco;DANIEL MORENO ÁLVAREZ;Oficial;Pública;;;608;Boyacá;15;Tunja;15001;3233993008;3770;78;;;;;;;;;;;;;;;;
Secretaría de Educación de Turbo;Nit;890981138;Edificio Pinorroa, Calle 104 N° 21-33 y Carrera 22 N° 104-17;YONATAN MADRID BERRIO;3206663185;6048275705;liderdeinspeccionyvigilancia@turboeducado.edu.co;inspeviud@turboeducado.edu.co;https://www.turboeducado.edu.co;Entidad Territorial Certificada;LUZ HELENA DE ARCO PINEDA ;Hector Humberto Hernandez;YONATAN MADRID BERRIO;Oficial;Pública;;;604;Antioquia;5;Turbo;5837;3206663185;3763;56;;;;;;;;;;;;;;;;
Secretaría de Educación de Uribia;Nit;892115155;Calle 12 No. 8 - 61;YELENCA ELENA GUTIÉRREZ FAJARDO;3106555193;6047177110;dgutierrez@semuribia.gov.co;dfgcotes1@hotmail.com;https://semuribia.gov.co/semuribia/;Entidad Territorial Certificada;DOMINGO FRANCISCO GUTIERREZ COTES ;Jenifer Jaine Vergara Garces;YELENCA ELENA GUTIÉRREZ FAJARDO;Oficial;Pública;;;604;La Guajira;44;Uribia;44847;3106555193;4460;204;;;;;;;;;;;;;;;;
Secretaría de Educación de Valle del Cauca;Nit;890399029;Carrera 6 Calle 9 y 10 Mezzanine  Edificio Palacio de San Francisco;OFELIA CECILIA DORADO ZÚÑIGA;3154729363;6026200000 ext 1500;caforero@valledelcauca.gov.co;ssarmiento@valledelcauca.gov.co;https://www.valledelcauca.gov.co/educacion/;Entidad Territorial Certificada;CELIAR ANIBAL FORERO;Jenifer Jaine Vergara Garces;OFELIA CECILIA DORADO ZÚÑIGA;Oficial;Pública;;;602;Valle del Cauca;76;Cali;76001;3154729363;3817;196;;;;;;;;;;;;;;;;
Secretaría de Educación de Valledupar;Nit;800098911;Carrera 12 No. 18 - 72;CAMILO ANDRÉS PINTO MORÓN;3160551745;6055748230;germanlorduy@semvalledupar.gov.co;kenyiorito@gmail.com;https://www.semvalledupar.gov.co;Entidad Territorial Certificada;GERMAN ALBERTO LORDUY HERNANDEZ ;Jenifer Jaine Vergara Garces;CAMILO ANDRÉS PINTO MORÓN;Oficial;Pública;;;605;Cesar;20;Valledupar;20001;3160551745;3780;98;;;;;;;;;;;;;;;;
Secretaría de Educación de Vaupés;Nit;845000021;Calle 14 No. 14 – 52 Parque Santander;PLINIO RESTREPO PRADA;3193040787;6085642107;inspeccionvigilanciaeducacion@vaupes.gov.co;inspeccionyvigilancia@sedvaupes.gov.co;https://www.sedvaupes.gov.co/;Entidad Territorial Certificada;NÉSTOR MAURICIO GARZÓN GÓMEZ;Loida Ruth Silva Morales;PLINIO RESTREPO PRADA;Oficial;Pública;;;608;Vaupés;97;Mitú;97001;3193040787;3831;198;;;;;;;;;;;;;;;;
Secretaría de Educación de Vichada;Nit;800094067;Calle 18 N° 7 -25 Barrio El centro;JUAN CARLOS COLINA BARÓN;3123499369;6085654975;inspeccionyvigilancia@sedvichada.gov.co;jairoefren68@hotmail.com;https://www.sedvichada.edu.co/;Entidad Territorial Certificada;JAIRO EFRÉN PARDO RINCÓN ;Hector Humberto Hernandez;JUAN CARLOS COLINA BARÓN;Oficial;Pública;;;608;Vichada;99;Puerto Carreño;99001;3123499369;3832;200;;;;;;;;;;;;;;;;
Secretaría de Educación de Villavicencio;Nit;892099324;Calle 40 No. 33 - 64 Alcaldía Municipal Piso 4;WILLIAM FERNANDO ZÁRATE VELÁSQUEZ;3144382203;6086715844;nancy.baquero@villavicencio.gov.co;najaba270406@gmail.com;https://www.semvillavicencio.gov.co/;Entidad Territorial Certificada;NANCY JAZMILE BAQUERO DIAZ;Hector Julio Flechas Pacheco;WILLIAM FERNANDO ZÁRATE VELÁSQUEZ;Oficial;Pública;;;608;Meta;50;Villavicencio;50001;3144382203;3797;136;;;;;;;;;;;;;;;;
Secretaría de Educación de Yopal;Nit;891855017;Calle 16 No 17-71 ;DAVID FEDERICO DÍAZ SÁNCHEZ;3144157784;6086345913 Ext.1028;inspeccioneducacion@yopal-casanare.gov.co;liandreun@hotmail.com;https://www.secretariadeeducacion-yopal.gov.co/;Entidad Territorial Certificada;LIBIA ANDREA CHAPARRO NIÑO;Hector Julio Flechas Pacheco;DAVID FEDERICO DÍAZ SÁNCHEZ;Oficial;Pública;;;608;Casanare;85;Yopal;85001;3144157784;4841;261;;;;;;;;;;;;;;;;
Secretaría de Educación de Yumbo;Nit;890399025;Calle 5 No. 4 - 40  Parque Belalcázar;LINA MARIA PEÑA TORO ;3107209520;6026516600;inspeccionyvigilancia@yumbo.gov.co;omarpabon@yahoo.es;https://semyumbo.gov.co/;Entidad Territorial Certificada;OMAR PABÓN CANENCIO ;Hector Julio Flechas Pacheco;LINA MARIA PEÑA TORO ;Oficial;Pública;;;602;Valle del Cauca;76;Yumbo;76892;3107209520;4832;269;;;;;;;;;;;;;;;;
Secretaría de Educación de Zipaquirá;Nit;899999318;Carrera 13 No 3C- 15 Barrio San Pablo ;ADNEY SATTY RAMIREZ RINCON;3208192754;6018523255 Ext: 101;inspeccionedu.profez@zipaquira.gov.co;juliangarcia0304@gmail.com;https://www.sezipaquira.gov.co/;Entidad Territorial Certificada;JULIÁN ANDRÉS GARCÍA ÁLVAREZ ;Hector Julio Flechas Pacheco;ADNEY SATTY RAMIREZ RINCON;Oficial;Pública;;;601;Cundinamarca;25;Zipaquirá;25899;3208192754;10930;257;;;;;;;;;;;;;;;;
